"Catalog_ID","Quantity","Name","Price","Brewery","Beer","ABV","IBU","Style","Sub.Style","Rating","Description","Last_Updated"
"2OPY7KH2QTELRTJWK2L6FQX2",12,"Von Ebert Quality of Silence 500ml",12,"Von Ebert Brewing","The Quality of Silence",5.9,NA,"Farmhouse Ale","Other","(4.14)","Blended mixed-culture beer w/ light Rainier cherry addition; (tart, citrus,marzipan, hint of cherry)  ","2020-10-22 12:26:24"
"RDKLWYCQVTJBW5SJA4KE3SYT",23,"Cellarmaker When Doves Cry 16oz",4.75,"Alvarado Street Brewery","When Doves Cryo",7,50,"IPA","American","(3.96)","Collaboration with our hop heroes at Cellarmaker; a hazy IPA brewed with a neutral ale yeast for pure hop expression. Battered with fresh 2018 Nelson Sauvin hops along with Galaxy and Mosaic cryo powder for a burst of tropical fruit notes. Ultra soft texture and silky mouthfeel from the addition of Mecca Grade hard red wheat and a blend of oats.","2020-10-22 12:26:24"
"XYKZRZYVHYVE7LSZESWKBP2X",12,"Traquair Jacobite 500ml",7.5,"Traquair House Brewery","Jacobite Ale",8,NA,"Pale Ale","Scotch Ale / Wee Heavy","(3.76)","Traquair Jacobite Ale is a Scotch ale with an ancient ingredient, coriander: rich, deep flavors are accented by exotic coriander aroma. Traquair House Brewery, located within Scotland's oldest inhabited house, uses a 1738 copper kettle and oak fermenters to produce this fine ale, first brewed in 1995 to commemorate the Jacobite Revolution. ","2020-10-22 12:26:24"
"YEREXUSJRUAMRA2USWSQWQ2A",22,"Iron Horse Aloha Death/Mocha Death",2,"Iron Horse Brewery","Aloha Death",6.56,NA,"IPA","Dark Ale","(3.76)","Coconut dark smooth ale ","2020-10-22 12:26:24"
"D56O77OENCZXTEIWEIYM5RMZ",24,"Second Profession Sound system iPA",3.75,"Second Profession Brewing","IPA Soundsystem",6.7,74,"IPA","American","(3.65)","","2020-10-22 12:26:24"
"3ABQYFCZ7MDV2GOFW5MW6YWC",21,"Sunriver Cocoa Cow 16oz",3.75,"Sunriver Brewing Company","Cocoa Cow - Chocolate Milk Stout",7,28,"Stout","Milk / Sweet","(4.17)","Milk sugar, cocoa nibs, and caramel malt build the rich, full body of this brew, with mild roasted notes coming from three varieties of chocolate malt. Have some dessert today - served in a glass!","2020-10-22 12:26:24"
"L3P6CQOUVKEYLJKQUZ7OMX3O",12,"Block 15 Sajhon 500ml",12.5,"Block 15 Brewing Company","Såjhon",4.8,NA,"Farmhouse Ale","Saison","(N/A)","Såjhon blends classic Saison yeast and Brettanomyces. Mild funk and delicate acidity support notes of fresh hay and countryside flowers from a duo of noble German hops. A robust grist profile of both rye malt and flaked corn lend dryness and rustic earthiness to the finish. ","2020-10-20 12:46:34"
"JE4NCOFWYZSN6ZF6KFV776IT",23,"Crooked Stave Kiwi IPA 12oz",2.5,"Crooked Stave Artisan Beer Project","New Zealand Kiwi IPA",6.2,NA,"IPA","American","(3.64)","New Zealand Style Kiwi IPA Brewed with Kiwi Fruit Double Dry Hopped with a New Zealand Field Blend ","2020-10-20 12:46:34"
"MEMOOEDUKVL7ZGLIVTHSI36N",23,"Urban Roots Strata Tactics 16oz",5,"Urban Roots Brewing & Smokehouse","Strata Tactics",8.2,NA,"IPA","Imperial / Double New England","(4.16)","An Unfiltered Double IPA featuring 100% Strata hops that were field selected by us for your enjoyment. <U+2800>","2020-10-20 12:46:34"
"2SJ5KV4ONS54ALLCVKUH2RWF",10,"Crooked Stave Stay the Funk 750ml",12.5,"Crooked Stave Artisan Beer Project","Stay the Funk In",6.3,12,"Lambic","Traditional","(4.11)","Méthode Traditionnelle Spontaneous Ale Aged in Oak Barrels ","2020-10-20 12:46:34"
"CURXQYHMQKBITUXLKTZ2WOS6",23,"Level Speak to the Manager/Neon Snowsuit 16oz",3.75,"Level Beer","I’d Like To Speak To The Manager",5.4,NA,"Brown Ale","English","(3.62)","Pumpkin spice latte ale. An English-style Brown ale with lactose, pumpkin, coffee and reasonably spiced with pumpkin spices. ","2020-10-19 12:47:57"
"5IMOY62R7Z66MDF4JTVUPI3Y",16,"Strainge Beast Blueberry Basil 16oz",3.75,"Strainge Beast","Blueberry, Acai & Sweet Basil",7,NA,NA,"Kombucha","(3.55)","Twisting skyward, coy and sweet,","2020-10-19 12:47:57"
"XXB26MGYCUMLTA2JMYRYRCH3",24,"Deschutes Jubelale 12oz",2.5,"Deschutes Brewery","Jubelale",6.7,65,NA,"Winter Ale","(3.59)","A dark, malty celebration ale with layered flavors and beautifully balanced hopping. Jubelale pours deep garnet in color, medium bodied, with notes of chicory, earth, spice and fruit. To beer lovers, it’s like Yule fire and family. ","2020-10-19 12:47:57"
"7VSF2E3C2FN7BJUMMQRJMFZX",22,"Varietal/Holy Mountain Hopfen Keller 16oz",4.25,"Varietal Beer Co.","Twine Climber",6.7,NA,"IPA","American","(3.92)","Citra + Simcoe + Mosaic ","2020-10-18 13:24:42"
"RIGNJJPVC34R5VPBLQFIPIAX",12,"Casa Agria Second Stone 500ml",12.5,"Casa Agria Specialty Ales","Second Stone",5.2,NA,"Farmhouse Ale","Saison","(4.14)","Second Stone is a Saison primary fermented on second-use Apricots, Nectarines and Peaches for a beautiful balance of fruit and saison! ","2020-10-18 13:24:42"
"M2VE7U4547U64MHO3H5PYWOU",21,"Boss Rambler Beer Club Citra Blow 16oz",4.5,"Boss Rambler Beer Club","Citra Blow",7,NA,"IPA","New England","(3.88)","DDH 100% Citra","2020-10-18 13:24:42"
"Z7X6RUXANNJLDCSZEP3B7TQG",10,"Ale Apothecary Darling 500ml",12.5,"The Ale Apothecary","Darling (Ales For ALS)",5.5,NA,"Farmhouse Ale","American Wild Ale","(N/A)","Fruity, quince, session ","2020-10-18 13:24:42"
"GJIQUR6DUYBSQ6DG2JYHI7N2",24,"Firestone Walker Chocolate Cherry 12oz",2.5,"Firestone Walker Brewing Company","Chocolate Cherry Stout",5.5,NA,"Stout","Other","(3.82)","An all new beer brewed with natural cherries and cocoa nibs. Subtle cherry fruit and cocoa notes blend with dark roasted malt complexity, to create an irresistible flavor pairing made for fall season enjoyment. ","2020-10-16 13:06:16"
"RZBABFESBMNCR6OXDCLFN2WJ",24,"Brewery Ommegang Philosophy 16oz",4.5,"Brewery Ommegang","Philosophy And Velocity (East Coast Edition)",10.8,NA,"Brown Ale","Belgian Quadrupel","(4)","Philosophy and Velocity combine two iconic imperial beers from East and West: Brewery Ommegang’s Three Philosophers, and Alesmith Brewing’s Speedway Stout. For this project, each brewery crafted a singular blend to release through their own channels. From the East Coast, Ommegang brewed a Belgian-inspired version of Speedway Stout to blend with their Three Philosophers Quadruple Ale. From the West, Alesmith brewed an American ale variant on Three Philosophers to blend with their robust, coffee-infused Speedway Stout. Philosophy, meet Velocity ","2020-10-16 13:06:16"
"D4EKAI4XWO66EKSYQPI2LGCK",24,"Fremont Field to Ferment 16oz",3.75,"Fremont Brewing","Field to Ferment Fresh Hop Pale",6,50,"Pale Ale","American","(3.9)","Fresh Hop Pale Ale ","2020-10-16 13:06:16"
"F5RRX54A6JWQCHMVFFKKH46S",24,"Athletic Upside Dawn 12oz",2,"Athletic Brewing Company","Upside Dawn Golden Ale",0.4,15,NA,"Non-Alcoholic Beer","(3.32)","Refreshing, clean, balanced, light-bodied. Aromas subtle with floral and earthy notes. Brewed with premium organic malts from US & Germany along with combo of English and traditional American hops to the golden ale style. 50 Calories. ","2020-10-16 13:06:16"
"JVKLCYCD26GWZHXN5DKKJGN3",24,"Ommegang Rosetta 12oz",3.75,"Brewery Ommegang","Rosetta",5.6,9,"Sour","Fruited","(3.84)","The time-honored Belgian tradition of aging and blending fruit beers is lovingly expressed in this lively creation, named for legendary brewmaster Rosa Merckx of Liefmans, our sister blendery in Belgium where this beer is crafted. ","2020-10-16 13:06:16"
"EK64NCXGPFWUPIKMKAXH3DBK",24,"Hopworks Ace Of Diamonds 16oz",4.25,"Hopworks Urban Brewery","Ace of Diamonds",7.8,NA,"IPA","Imperial / Double Black","(N/A)","","2020-10-16 13:06:16"
"MUSG7ZEQGCUM2OWY4QGIQFAJ",24,"Hair of the Dog Putin 12oz",27,"Hair of the Dog Brewing Company","Hair of the Dog Stout Putin",14,NA,"Stout","Imperial / Double","(N/A)","","2020-10-15 13:00:45"
"OCOQ2FE5VSS2GONJ5HGWEKNL",5,"DeGarde The Blackberry",18,"de Garde Brewing","The Blackberry",6.8,NA,"Farmhouse Ale","American Wild Ale","(4.24)","A spontaneous wild ale blended from two years aged in oak barrels with blackberries. ","2020-10-15 13:00:45"
"FXLNRPZPBAPFBPLP6GX3NYHR",12,"Swift Pomegranate 16oz",5.75,"Swift Cider","Pomegranate",6.5,NA,"Cider","Other Fruit","(3.8)","Hard cider, pomegranate juice. ","2020-10-15 13:00:45"
"IGX37HBD3OCLOUW765ORNDOZ",24,"Alesmith Diego Antonio 16oz",3.25,"AleSmith Brewing Company","Diego Antonio",7.7,35,"IPA","American","(3.88)","West Coast- style IPA brewed with Citra and Nelson hops. A collaboration brew with Weathered Souls Brewing Company from San Antonio, Texas. ","2020-10-15 13:00:45"
"W57FI3GMTF7WORMBRXIA5MLF",24,"Uerige Doppelsticke 330ml",5,"Uerige Obergärige Hausbrauerei","DoppelSticke",8.5,75,"Pale Ale","Altbier","(3.59)","Since 2005, Uerige has also been brewing a special strong beer for the American market. Our Doppelsticke has a remarkable 8.5% abv and yet tastes unmistakable: it truly is the yummy droplet!","2020-10-15 13:00:45"
"FRA3DB7WHVCVXRLMBEKRLHFV",24,"Veltins Pilsner 500ml",2.5,"Brauerei VELTINS","Veltins Pilsener",4.8,30,"Pilsner","German","(3.16)","","2020-10-15 13:00:45"
"4PSRYAWA6RHE5UB5FSZIIDOF",48,"Casa Agria Casa Del Norte 16oz",4.25,"Casa Agria Specialty Ales","Casa Del Norte",7.1,NA,"IPA","American","(4.12)","Casa del Norte is a Hazy American IPA whose name is a nod to where our home is. Del Norte Boulevard points us to the mountains of north county every day and serves as a reminder to get outside. Brewed with Oats and Wheat this one was dry hopped with a mountainous addition of Nelson, Citra, Ekuanot, and Simcoe. Tropical fruit dominates the aromatics followed by sweet lemon, and juicy tangerine. The medium body is full enough without being sweet and the flavors are an equal blend of citrus and stone fruit. Lead the way and we will find it together! ","2020-10-14 12:37:52"
"BVKNHQPHDNLLXYCXB3EVKIRK",23,"Casa Agria Bracero 16oz",3.75,"Casa Agria Specialty Ales","Saison Bracero",4.9,NA,"Farmhouse Ale","Saison","(3.78)","Saison Bracero is a Dry-Hopped Farmhouse-style ale brewed to be dry and refreshing with a rustic quality coming from the use of wheat and rye and a satisfying hop character coming from Loral and Blanc. ","2020-10-14 12:37:52"
"WXPN4ZRBQGZRYJOLFVQTUFED",48,"Casa Agria Western Glow 16oz",4.25,"Casa Agria Specialty Ales","Western Glow",7.5,NA,"IPA","American","(4.22)","Western Glow is a hazy American India Pale Ale brewed with malted wheat and flaked oats. Mosaic was used in the kettle of this batch to add complimentary flavors to the expressive yeast strain and equal parts of Citra and Mosaic were used for the dry hop which just create special aromatics together that we just love! ","2020-10-14 12:37:52"
"LAUBQEMJS55TUGMHBIL4Y7NV",44,"Fieldwork King Citra 16oz",5.5,"Fieldwork® Brewing Company","King Citra®",8.7,NA,"IPA","Imperial / Double","(4.22)","The clock strikes noon as King Citra awakens in his parents' basement with only one thing on his mind, battle. He straps on his cardboard chainmail, arms himself with his pool-noodle broadsword, grabs his brown bag lunch, and heads to Ohlone Park to continue with his campaign. With a towering aroma of mom's fresh squeezed orange juice and tangerines freshly picked from the backyard, no one will be competing with the king today. A thick and full mouthfeel creates an Orange Whip-like profile that sticks to the palate with a refreshingly dessert-esque fervor, slowly giving way to a soft bite of carbonation. As the sun sets across the horizon King Citra fires thunderbolt after thunderbolt at every taste receptor till they are overwhelmed and he struts away, crown atop his head, still reigning supreme over his Empire of Double IPA. ","2020-10-14 12:37:52"
"7WQ2RDK57NITWRVF5IXZ5FOD",23,"Drekker I don’t Know 16oz",3.5,"Drekker Brewing Company","I Don't Know No Snakes",5,NA,"Lager","American","(3.82)","Officially the unofficial beer of the Wet Bandits that is perfect for dodging booby traps & back-room super secret scheming. I Don’t Know No Snakes is a lagerbier we’ve been working on for a while now and it’s crazy tight and delicate with no room to hide your ulterior motives. Built on a base of the amazing and subtle Italian Ericlea malt, we sprinkled in carafoam and rice to keep it crispy with a creamy foam head. Then we snuck in some Hallertau Blanc for a gentle and deft dry hop. It’s so clean and crushable you probably won’t even notice AC ain’t in charge no more and Snakes, I’m gonna give you to the count of ten... <U+2800><U+2800>","2020-10-14 12:37:52"
"SXR3AKZCLHMMGZKZT3V4AXV2",46,"Casa Agria enmeshment 16oz",4.25,"Casa Agria Specialty Ales","Enmeshment",7.2,NA,"IPA","American","(3.91)","Enmeshment was brewed in collaboration with our buds at Burgeon Beer Company from Carlsbad, California. This is an unfiltered WEST COAST IPA brewed with wheat and fermented with everyone's favorite clean ale yeast. It was then dry hopped Citra, Simcoe and Michigan grown Chinook. ","2020-10-14 12:37:52"
"PN3ID4XIUFYNITCK6MSQDD74",47,"Casa Agria Life and Style 16oz",4.25,"Casa Agria Specialty Ales","Life And Style",7.4,NA,"IPA","American","(4.02)","A West Cost IPA hopped with Enigma and Simcoe. ","2020-10-14 12:37:52"
"C7ECXY36DXG3UCCQQUJVOSGW",20,"Drekker Ectogasm 16oz",4.25,"Drekker Brewing Company","Ectogasm",7,65,"IPA","New England","(4.12)","Ectogasm is a juicy, hazy, and soft NE IPA brewed with Citra & Mosaic hops. ","2020-10-14 12:37:52"
"IC2KEX2NQJF2KVQVKGJWAK6A",48,"Source Source of Happiness 16oz",7,"Source Brewing","Source of Hoppiness",6.5,NA,"IPA","New England","(4.04)","This IPA pours a hazy yellow-orange hue and is bursting with intense aromas of tropical and citrus fruits, berries, and stone fruits. Restrained bitterness and heavy additions of malted wheat and oats in the mash give this beer a soft, rounded mouthfeel. Several whirlpool hop additions and a double-dose of dry-hopping provide this beer with insanely fruity aromas and flavors with a juicy, refreshing finish. ","2020-10-14 12:37:52"
"YSOTFD5HLWUNUQ4IIGSBLAP2",3,"Anchorage Scream 375ml",9.5,"Anchorage Brewing Company","Scream",7,NA,"Sour","Fruited","(4.23)","This is our a sour beer fermented and aged in Missouri oak foeder, then finished on literal tons of Alaska grown Haskap berries from Alaska Berries. ","2020-10-14 12:37:52"
"ZH655G2PEK7735GCSDQSGSRW",12,"Ale Apothecary Bitter 500ml",12.5,"The Ale Apothecary","Sahalie, Botteld May 17, 2018",10.33,NA,"Farmhouse Ale","American Wild Ale","(4.38)","","2020-10-13 12:26:12"
"CEJAK2VHZAPH5LT4CNBXSEU5",24,"Ale Apothecary Raspberry/Plum Gose 500ml",12.5,"The Ale Apothecary","Tequila / Raspberry La Tache",7.96,NA,"Farmhouse Ale","American Wild Ale","(4.39)","Bottled July 2017, brewed June of 2016. We aged this batch of La","2020-10-13 12:26:12"
"ZGLDCO5U2KWSEVLMA3267LZL",23,"Varietal Wolf Factory 16oz",4.5,"Varietal Beer Co.","Wolf Factory V3",5.9,NA,"IPA","American","(3.9)","(Canned 7-8-20)The latest version of WOLF FACTORY is a hazy IPA brewed with 2-Row, Munich malt & Oats, then hopped with Ernest, Cashmere, Citra & Comet. It’s a softer IPA with juicy fruit bubblegum flavor & aroma. ","2020-10-13 12:26:12"
"C2LTAZB54GDX6WV2JBA2ZKKQ",11,"Orval 2018",9,"Brasserie d'Orval","Orval (2018) ",6.2,36,"Pale Ale","Belgian","(3.92)","","2020-10-12 12:35:48"
"SVEWDAC3LAFZD6X46B6YWXSO",20,"Logsdon kosch 4.5 16oz",3,"Logsdon Farmhouse Ales","Kolsch 4.5",4.5,NA,"Lager","Kölsch","(3.79)","","2020-10-12 12:35:48"
"6MZV5DDERKFNVBT5XPYHJDMS",12,"Cellarmaker Tropical Impressions 500ml",16.5,"Cellarmaker Brewing Company","Tropical Impression",6.8,6,"Farmhouse Ale","Saison","(4.17)","Like the fruit stands of Hawaii, Tropical Impression is loaded with guava and passionfruit. The beer makers of Cellarmaker judiciously selected three oak barrels of brightly aromatic mixed-culture saison that would will accompany the fruit we were to use. As crushable as they come! ","2020-10-09 13:07:57"
"VRI76IEGXU7HLI6UHTMJC6TC",12,"Cellarmaker Syrah Shorty 750ml",14.5,"Cellarmaker Brewing Company","Syrah Shorty (2020)",5.5,NA,"Sour","Fruited","(4.09)","Formerly known as Grape Shorty. Wild ale with 2019 Syrah Grapes from C5 Vineyard. After a beer sees fruit, the fruit usually still has a little love to give. The syrah grapes in Syrah Shorty have already seen a barrel aged sour, but we steeped them again in fresh beer to extract even more of their floral and plum aroma and tannic structure. The result is a tart crushable ale with hints of strawberry, raspberry and rosé wine ","2020-10-09 13:07:57"
"RQ2UOU7XSTBA6DJ3JD477D74",24,"Cellarmaker Mo Idaho 7 16oz",4.5,"Cellarmaker Brewing Company","Mo' Idaho 7",6.8,58,"IPA","American","(4.12)","The legend continues, Wu Tang, Wu Tang. Wait, sorry, wrong legend. The legend of our Mo’ series has a new addition with the dynamic Mosaic hop now teaming up with a fairly new amazing hop unfortunately named Idaho 7 (#notasexyname). But don’t let the name fool you as Idaho 7 brings attractively piquant elements of white gummy bear and citrusy pine! ","2020-10-09 13:07:57"
"7UFK3CKNA7JP3C6P4K3CD3YA",24,"Culmination West Coasr Story 16oz",3.75,"Culmination Brewing Company","A West Coast Story",6,NA,"IPA","American","(3.72)","West Coast IPA with rotating hop profiles. ","2020-10-09 13:07:57"
"D2TQN2QDMOR7ATMH3X6EJ7X6",90,"Wayfinder Funeral Bock 16oz",4,"Wayfinder Beer","Funeral Bock",7,NA,"Bock","Single / Traditional","(4.09)","Double-decocted black bock brewed strongly with Münich and Roast malts and fermented extremely cold with our secret heritage lager yeast and finished with an excessive, hibernative lagering schedule. This iteration of German bockbier is our dirge to the Fall. ","2020-10-09 13:07:57"
"4X6RYQJX74YKZ7AE4KEW2OK2",2,"La Familia Guayaba Cider 12oz",3,"La Familia Cider","Guayaba",5.2,NA,"Cider","Other Fruit","(N/A)","Tart, Tropical, Citrus","2020-10-09 13:07:57"
"HG33I2LEZPASSJXXBHHSWMHU",24,"Fremont Head Full Of Fresh Hops 16oz",4.25,"Fremont Brewing","Head Full of Fresh Hops",6.8,NA,"IPA","New England","(4.09)","Head Full of Fresh Hops starts with select fresh hops harvested in Yakima and loaded into the brew kettle within 24 hours of harvest. Fresh hop beers signal the harvest season in the Pacific Northwest and are the height of our brewing year. 2-Row Pale, Rolled Oats, Flaked Wheat, and White Wheat with Mosaic and Ekuanot hops and Lactose. ","2020-10-09 13:07:57"
"AZQSWV7VWTJOFNNBJWDBOCIE",24,"Fremont Cowiche Canyon 12oz",2.75,"Fremont Brewing","Cowiche Canyon Fresh Hop Ale",6,50,"Pale Ale","American","(4.12)","Cowiche Canyon Fresh Hop Ale is brewed from select organic hops grown in the Cowiche Canyon of the Yakima Valley which are harvested and placed into our kettle within 24 hours, creating a unique, once-a-year beer. We make Cowiche Canyon ale in partnership with hop-growing wizards from the Yakima Valley in an effort to expand the organic hop industry in Washington State… Because Organic Hops Matter. A portion of all sales fund the Cowiche Canyon Conservancy. ","2020-10-09 13:07:57"
"LXAEX75VLLXPPQDZJQNIC3K7",24,"Our Mutual Friend Inner Light 16oz",3.75,"Our Mutual Friend Brewing Company","Inner Light",5.8,NA,"Wheat Beer","American Pale Wheat","(3.83)","","2020-10-09 13:07:57"
"IZKES43XUPNLOB7FT3OXHHYK",24,"Sierra Nevada Pale 16oz",2.5,"Sierra Nevada Brewing Co.","Pale Ale",5.6,38,"Pale Ale","American","(3.64)","Our most popular beer, Sierra Nevada Pale Ale is a delightful interpretation of a classic style. It has a deep amber color and an exceptionally full-bodied, complex character. Generous quantities of premium Cascade hops give the Pale Ale its fragrant bouquet and spicy flavor. ","2020-10-09 13:07:57"
"2ON5IFKAZ3QEBN4KB7HBVSMS",24,"Lagunitas Born yesterday 12oz",2.75,"Lagunitas Brewing Company","Born Yesterday Pale Ale",7.2,60,"Pale Ale","American","(4.05)","Born Yesterday is a newborn verson of our reborn pale, New Dogtown Pale, with a fresh addition: Virgin hops from the trellised lands of the verdant Yakima Valley. Unkilned for an immaculate reception. Then deliver the resulting lil’ brew in 24hrs. Congrats. Its a beer! ","2020-10-09 13:07:57"
"FTGXJOJKKBWNQV4QW324XUHG",72,"Anchor Steam 19.2oz",3,"Anchor Brewing Company","Anchor Steam Beer (1993) ",5,NA,NA,"California Common","(N/A)","Best before march 1994 ","2020-10-09 13:07:57"
"K5ZNRCVF6A7QERCH6IVJXRUM",24,"Rev Nat’s Revival 12oz",2.5,"Reverend Nat's Hard Cider","Revival",6,NA,"Cider","Traditional","(3.67)","Revival begins simply: select the best whole apples in the world, grind them up and cold press them, just like farmers do every harvest. Then I add Dark Muscovado, an unrefined cane juice grown in Mauritius. This blend of cane and apple juices is fermented to complete dryness using a Belgian saison ale yeast (producing round and creamy mouthfeel) and an exotic secret strain carefully managed to give waves of pineapple, guava and peach flavors. Back-sweetened with fresh apple juice, never from concentrate. Brilliantly golden in color and deeply complex while remaining subtly familiar, with just the right amount of sweetness and acidity to be an everyday beverage, this cider represents the culmination of my 10 years of cider making. ","2020-10-09 13:07:57"
"634CZ7HVUMX6CLIGSUOA6X7L",12,"Away Days Bus Stop Bitter",4,"Away Days Brewing Co.","Bus Stop Bitter",4.5,NA,"Pale Ale","English Bitter","(3.83)","As the style suggests, this beer is driven by a strong but palatable bitterness. A soft, toasty, biscuit like foundation from Maris Otter malt along with a slight honey note helps support the overall showcase of traditional English hops. East Kent Golding and Challenger hops were used for their classic contributions. EKG lends earthy spice and resinous herbal character to the palate. A sizeable charge of Challenger hops late in the kettle adds pleasant floral, marmalade, and stone fruit notes. The strong bitterness, dry finish, and low alcohol content makes for a quaffable beer that you can enjoy more than a few of.","2020-10-08 12:55:49"
"BTNGFRDQJ2URIMDIEDK4DOYM",12,"Oregonic Tonic Chaibucha",4,"Oregonic Tonic","ChaiBucha",NA,NA,NA,"Kombucha","(N/A)","With Autumn here, the Chaibucha has become our fans' seasonal flavor of choice. Each sip is a rich, complex parade of spices across the tongue, helped along by the perfect promenade of bubbles. Lightly sweet but never syrupy. Pair with: crunchy leaves, crisp mornings, fireplaces. ","2020-10-08 12:55:49"
"SILA6QFUEFGRHQRTV62OYHCO",24,"Fortside Rosé Gone Wild 12oz",2,"Fortside Brewing Company","Rosé Gone Wild",5,NA,"Grape Ale","Other","(3.83)","A gluten reduced and craftily concocted hybrid wine/beer that drinks more like a Rose’ Spritzer -or, if you prefer, a delightfully complex and fruity hard seltzer. Rose Gone Wild greets the drinker with a fine effervescence that explodes with aromas of blackberry and meyer Lemon. The first sip dances with a light and refreshing tannic character that confirms the presence of wine grapes, if you weren’t already convinced by the gorgeous blush color. Finishing super clean and light bodied, this splurge of flavor engulfs the senses before disappearing into clean and pure refreshment. ","2020-10-08 12:55:49"
"SPBEVWT7VT5PCUSM4GF3MNLK",23,"Modern Times Logical Journey 16oz",3,"Modern Times Beer","Logical Journey (2020) ",4.8,NA,"Lager","Smoked Beer","(3.75)","If there’s a hole in your heart that you can’t seem to fill, it’s most-likely shaped like a delicious oak-smoked Helles lager. The good news is that we happen to have an insanely delicious one, brewed with extra pale pilsner malt, a touch of vienna malt, and a hefty portion of beech smoked barley malt complemented by a meticulously meted-out dose of Tettnang hops. Let the healing begin. ","2020-10-08 12:55:49"
"LKCNRMY4ID65VX52WWTGX7QO",24,"Modern Times MAX w/ Nelson 16oz",5.25,"Modern Times Beer","Max W/ Strata",7.1,50,"IPA","American","(3.97)","","2020-10-08 12:55:49"
"T2SNZK44R5D376RCDLVNWSWQ",17,"Outer Range Sunset Scenes 16oz",5.5,"Outer Range Brewing Co.","Sunset Scenes",8.5,NA,"IPA","Imperial / Double New England","(4.27)","Hops: Galaxy, Amarillo","2020-10-08 12:55:49"
"JF77F2I37C4PRO2AU2JRX7YN",24,"Outer Range  In the Steep 16oz",5,"Outer Range Brewing Co.","In the Steep",6.9,NA,"IPA","New England","(4.16)","Hops: Citra","2020-10-08 12:55:49"
"5IVDRV6DWLO2Q2XBAC7N44BT",24,"Prairie Key Lime 12oz",3,"Prairie Artisan Ales","Key Lime Pie",5,NA,"Sour","Fruited","(3.8)","Sour ale with key lime and vanilla ","2020-10-08 12:55:49"
"7EUHGLJD7TTKGCORTEELO5UZ",11,"Prairie Snickerdoodle Noir 12oz",14,"Prairie Artisan Ales","Vanilla Noir - Snickerdoodle",14.4,NA,"Stout","Imperial / Double Pastry","(4.31)","Bourbon barrel-aged imperial stout with snickerdoodle Chia cookies and vanilla. ","2020-10-08 12:55:49"
"FQQRZYGFDYDZBUWCQI6KP5XP",42,"Alvarado Double Fun 16oz",5.5,"Alvarado Street Brewery","Double Fun",8,NA,"IPA","Imperial / Double","(4.15)","Mosaic is fun. But Mosaic + Galaxy are DOUBLE FUN. Get your juice fix with these exceptionally lush hop varieties coupled with a fruity fermentation and silky contributions from a grip of oats & wheat in the mash. ","2020-10-08 12:55:49"
"WOLWUYTCBAUKZE4AJN53EUSG",42,"Alvarado Street Double Cone 16oz",5.5,"Alvarado Street Brewery","Double Cone",8.5,85,"IPA","Imperial / Double","(4.12)","OG Double IPA that's the baby brother of Triple Cone, our Triple IPA. Monster dry hop of Mosaic, Citra & El Dorado with a clean fermentation keeps it devilishly dank & lush on the nose with assertive oily hop flavor and bitterness. Dry finish, hidden alcohol makes it dangerously drinkable. ","2020-10-08 12:55:49"
"3YGPUQESIRA4SC3DV5PO5R42",24,"Boochcraft Spiced Pear 12oz",3,"Boochcraft","Spiced Pear",7,NA,NA,"Kombucha","(3.55)","","2020-10-08 12:55:49"
